{
  "version": "0.1.0-draft",
  "kind": "scalar_program",
  "illustrative": false,
  "id": "candidate",
  "semantic_profile_id": "scalar-wrapping-v1",
  "function": {
    "name": "clamp",
    "params": [
      {
        "name": "x",
        "type": "i64"
      }
    ],
    "return_type": "i64",
    "body": {
      "kind": "if",
      "type": "i64",
      "condition": {
        "kind": "binary",
        "type": "bool",
        "op": "lt_signed",
        "left": {
          "kind": "var",
          "type": "i64",
          "name": "x"
        },
        "right": {
          "kind": "int",
          "type": "i64",
          "value": "-10"
        }
      },
      "then": {
        "kind": "int",
        "type": "i64",
        "value": "-10"
      },
      "else": {
        "kind": "if",
        "type": "i64",
        "condition": {
          "kind": "binary",
          "type": "bool",
          "op": "gt_signed",
          "left": {
            "kind": "var",
            "type": "i64",
            "name": "x"
          },
          "right": {
            "kind": "int",
            "type": "i64",
            "value": "10"
          }
        },
        "then": {
          "kind": "int",
          "type": "i64",
          "value": "10"
        },
        "else": {
          "kind": "var",
          "type": "i64",
          "name": "x"
        }
      }
    }
  }
}
